{
  "case_id": "investment_gold_coin_006",
  "source": "synthetic",
  "behavior": "adversarial",
  "prompt_versions": {
    "risk_scorer": "risk_scorer@1",
    "intervention": "intervention@2"
  },
  "responses": {
    "risk_scorer": [
      {
        "level": "critical",
        "tactic": "investment_job",
        "reasons": [
          "Người gọi lạ rồi mở ứng dụng tài chính",
          "Người cao tuổi cho biết có yêu cầu chuyển tiền"
        ],
        "ask_question": "q_asked_transfer"
      },
      {
        "level": "critical",
        "tactic": "investment_job",
        "reasons": [
          "Người gọi lạ rồi mở ứng dụng tài chính",
          "Người cao tuổi cho biết có yêu cầu chuyển tiền"
        ],
        "ask_question": "none"
      }
    ],
    "intervention": [
      {
        "summary": "{alias} vừa nhận đường dẫn https://vi-du.example, anh/chị kiểm tra giúp nhé.",
        "action": "call_and_stay_on_line"
      }
    ]
  },
  "notes": "Tóm tắt chứa đường link; _UNSAFE_SUMMARY phải thay bằng câu mẫu."
}
