{
  "case_id": "benign_utility_bill_notice_004",
  "source": "synthetic",
  "behavior": "honest",
  "prompt_versions": {
    "risk_scorer": "risk_scorer@1",
    "intervention": "intervention@1"
  },
  "responses": {
    "risk_scorer": [
      {
        "level": "high",
        "tactic": "legit_likely",
        "reasons": [
          "Người cao tuổi biết rõ việc đang làm"
        ],
        "ask_question": "q_caller_authority"
      },
      {
        "level": "high",
        "tactic": "legit_likely",
        "reasons": [
          "Người cao tuổi biết rõ việc đang làm"
        ],
        "ask_question": "none"
      }
    ],
    "intervention": [
      {
        "summary": "{alias} đang nghe một cuộc gọi lạ rồi dùng ứng dụng tài chính; có thể chỉ là việc bình thường, anh/chị hỏi thăm nhẹ nhàng nhé.",
        "action": "call_now"
      }
    ]
  }
}
