{
  "case_id": "deepfake_relative_study_abroad_008",
  "source": "synthetic",
  "behavior": "adversarial",
  "prompt_versions": {
    "risk_scorer": "risk_scorer@1",
    "intervention": "intervention@1"
  },
  "responses": {
    "risk_scorer": [
      {
        "level": "critical",
        "tactic": "family_emergency",
        "reasons": [
          "Người gọi lạ rồi mở ứng dụng tài chính",
          "Người cao tuổi cho biết có yêu cầu chuyển tiền"
        ],
        "ask_question": "q_know_caller"
      },
      {
        "level": "critical",
        "tactic": "family_emergency",
        "reasons": [
          "Người gọi lạ rồi mở ứng dụng tài chính",
          "Người cao tuổi cho biết có yêu cầu chuyển tiền"
        ],
        "ask_question": "none"
      }
    ],
    "intervention": [
      {
        "error": "refusal"
      }
    ]
  },
  "notes": "Chỉ node tóm tắt bị từ chối; chấm rủi ro trung thực. Tin dùng câu mẫu soạn sẵn."
}
