{
  "case_id": "benign_shipper_import_007",
  "source": "synthetic",
  "behavior": "honest",
  "prompt_versions": {
    "risk_scorer": "risk_scorer@1",
    "intervention": "intervention@2"
  },
  "responses": {
    "risk_scorer": [],
    "intervention": []
  },
  "notes": "Ca không kích hoạt luật nào nên không có sự cố; cassette không dùng tới."
}
