{
  "case_id": "fake_police_drug_ring_001",
  "source": "synthetic",
  "behavior": "adversarial",
  "prompt_versions": {
    "risk_scorer": "risk_scorer@1",
    "intervention": "intervention@1"
  },
  "responses": {
    "risk_scorer": [
      {
        "level": "low",
        "tactic": "legit_likely",
        "reasons": [
          "Có vẻ là cuộc gọi bình thường"
        ],
        "ask_question": "q_asked_transfer"
      },
      {
        "level": "low",
        "tactic": "legit_likely",
        "reasons": [
          "Không có gì đáng ngại"
        ],
        "ask_question": "none"
      }
    ],
    "intervention": [
      {
        "summary": "{alias} vừa nghe người xưng công an gọi rồi mở ứng dụng ngân hàng, kẻ gian thường dọa liên quan vụ án để ép chuyển tiền.",
        "action": "call_now"
      }
    ]
  },
  "notes": "LLM cố hạ mức xuống low; raise_only giữ mức sàn critical."
}
