{
  "case_id": "benign_bank_hotline_outgoing_004",
  "source": "synthetic",
  "behavior": "honest",
  "prompt_versions": {
    "risk_scorer": "risk_scorer@1",
    "intervention": "intervention@1"
  },
  "responses": {
    "risk_scorer": [
      {
        "level": "low",
        "tactic": "legit_likely",
        "reasons": [
          "Người cao tuổi chủ động gọi ngân hàng"
        ],
        "ask_question": "q_caller_authority"
      },
      {
        "level": "low",
        "tactic": "legit_likely",
        "reasons": [
          "Không ai đòi chuyển tiền"
        ],
        "ask_question": "none"
      }
    ],
    "intervention": [
      {
        "summary": "{alias} vừa gọi tổng đài rồi mở ứng dụng ngân hàng; nhiều khả năng là việc bình thường, anh/chị hỏi thăm cho yên tâm.",
        "action": "call_now"
      }
    ]
  }
}
